{
  "status": "EXISTING",
  "as_of_utc": "2026-02-06T01:58:53.523871Z",
  "source": "DEMO_GENERATOR",
  "items": [
    {
      "id": "demo-2026-02-06-1",
      "headline": "Fed Signals Steady Approach Amidst Inflation Data",
      "summary": "Federal Reserve officials indicate patience as recent CPI prints show mixed signals. Markets await further guidance.",
      "bucket": "macro",
      "source": "MarketSniper Wire (Demo)",
      "published_utc": "2026-02-06T01:58:53.523871Z",
      "url": "#"
    },
    {
      "id": "demo-2026-02-06-2",
      "headline": "Tech Sector Earnings Preview: AI Spend in Focus",
      "summary": "Major semiconductor and cloud firms set to report. CapEx guidance is the key metric for institutional investors.",
      "bucket": "general",
      "source": "MarketSniper Wire (Demo)",
      "published_utc": "2026-02-06T01:58:53.523871Z",
      "url": "#"
    },
    {
      "id": "demo-2026-02-06-3",
      "headline": "Global Markets: Geopolitical Risk Limits Upside",
      "summary": "Tensions in key trade corridors continue to weigh on logistics stocks and energy futures.",
      "bucket": "macro",
      "source": "MarketSniper Wire (Demo)",
      "published_utc": "2026-02-06T01:58:53.523871Z",
      "url": "#"
    },
    {
      "id": "demo-2026-02-06-4",
      "headline": "Watchlist Movers: Intraday Volume Anomalies",
      "summary": "Automated scan detection of unusual volume in key index constituents.",
      "bucket": "watchlist",
      "source": "MarketSniper Wire (Demo)",
      "published_utc": "2026-02-06T01:58:53.523871Z",
      "url": "#"
    }
  ],
  "version": "1.0.0"
}